### ISSUE TITLE
client for Android doesn't handle IPv6=>v4 fallback correctly

### ISSUE THREAD

**Issue by hlinden** [owncloud/android#616]
At the moment, we're having trouble with the IPv6 connectivity to our OC server. Any browser does fallback to v4 almost immediately, as described in RFC 6555. The Owncloud client for Android only tries v6 and then fails. 

Here's what happens, when I've taken a picture and it tries the auto upload:
    01:51:42.081241 IP6 (hlim 64, next-header TCP (6) payload length: 40) 2001:470:2:2:2:2:2:2.43116 > our.owncloudserver.tld.https: Flags [S], cksum 0xb63c (correct), seq 2151544131, win 14400, options [mss 1440,sackOK,TS val 34809574 ecr 0,nop,wscale 6], length 0
    01:51:43.075235 IP6 (hlim 64, next-header TCP (6) payload length: 40) 2001:470:2:2:2:2:2:2.43116 > our.owncloudserver.tld.https: Flags [S], cksum 0xb5d8 (correct), seq 2151544131, win 14400, options [mss 1440,sackOK,TS val 34809674 ecr 0,nop,wscale 6], length 0
    01:51:45.072932 IP6 (hlim 64, next-header TCP (6) payload length: 40) 2001:470:2:2:2:2:2:2.43116 > our.owncloudserver.tld.https: Flags [S], cksum 0xb510 (correct), seq 2151544131, win 14400, options [mss 1440,sackOK,TS val 34809874 ecr 0,nop,wscale 6], length 0
    01:51:49.085056 IP6 (hlim 64, next-header TCP (6) payload length: 40) 2001:470:2:2:2:2:2:2.43116 > our.owncloudserver.tld.https: Flags [S], cksum 0xb37f (correct), seq 2151544131, win 14400, options [mss 1440,sackOK,TS val 34810275 ecr 0,nop,wscale 6], length 0

(adresses redacted, of course)

...and that's that. The client then marks the upload as failed. Expected behaviour should be to fall back to v4 and try again.

Weirdly enough, it works nicely when used in a dual stack environment with ULA-v6 Adresses and NAT6 towards the internet. I dind't have a chance to inspect the traffic there, could it be that despite a working v6 connection it immediately uses v4?

**Comment by danimo** [comment]
@davivel I sent you the credentials to a dual-stack-served owncloud instance. We should fix this.

**Comment by AlterDepp** [comment]
I think it's the same problem at me. I have a server which is connected by ipv4 and ipv6, but I'm not sure, if ipv6 is working. My client is from f-droid, version 1.7.2, owncloud server is 8.1.3. I turned off ipv6 on my router and connection was fine. After configuring the owncloud client, I reenabled ipv6 and everything worked fine. Other apps like owncloud news reader, owncloud bookmarks, DAVdroid did not have this problem.
Stefan

**Comment by corneverbruggen** [comment]
I can confirm this. Also had to disable IPv6 on my router to make the android app connect to my owncloud server, while the same device can connect to the OC web interface in a browser just fine and the CalDAV-sync/CardDAV-sync also have no problems.

**Comment by bebehei** [comment]
So I had the same issue as #516 but there was no entry showing up in the log on my server. Finally, I found out, it had to do with my setup provided by KabelBW. They use mainly IPv6.

wget with -4 and -6 both work without any flaws. ... But my phone fails!?

Could someone please fix this? (Or at least mark it as a bug? This is clearly not an enhancement.)

**Comment by zem** [comment]
Hello together, same problem here. The problem is that my phone does not get an IPv6 address at all from the router. So only the Link local v6 is there, but the client is trying to connect even without that v6 address. I would not be surprised if that problem is more android related, however I would like to see a hotfix that does not include to deactivate the IPv6 Stack in all the hotspots of the world.

**Comment by haarp** [comment]
This is indeed still a problem. And not easy to discover. If IPv6 is available and the app connects to a domain that has both A and AAAA records, it tries IPv6 and aborts if that fails.

**Comment by kdickerson** [comment]
I can confirm this issue.

I have OwnCloud running on a server on my home network (with firewall rules allowing outside connections).

I recently configured my router for IPv6 (so the OwnCloud server gets IPv6 and my wifi devices get IPv6).  When my Android devices have IPv6 addresses the Owncloud app can no longer connect to the server.  I can't upload files or refresh folder lists.

I just disabled IPv6 and reconnected my phone (server and client now both using IPv4) and everything works again.  I re-enabled IPv6 and it stops working.

My OwnCloud server uses dynamic DNS to set its public IPv4 into the A DNS record.  I have manually set the AAAA DNS record for now (as my DNS provider doesn't support dynamic IPv6).  I can successfully connect to my server and OwnCloud using IPv6 from PCs inside and outside my home network (I don't have any non-Android mobile devices to try).

I can try to gather any further information if desired.

**Comment by zem** [comment]
At thy moment I have a special DNS entry for my cloud returning only the ipv4 address as a workaround.

**Comment by 9662** [comment]
Seeing the same issue here. But the weirdest thing is that it wasn't happening until now. I last used the Android client on my home WiFi on Sunday and it worked fine. The only thing changed since is the ownCloud server having had its kernel upgraded by the automatic patching system and rebooted manually yesterday, but I can't see how that could possibly have an impact.

If in a hurry and unable to switch to data connection or similar, what @zem proposes is an option (you will have to add the new hostname to your X.509 cert though).

**Comment by kesavanm** [comment]
Switching from auto config to DHCP Server on Pv6 settings inside Gateway router can let Android ownCloud sync with self certified one.
![dhcp-server](https://cloud.githubusercontent.com/assets/1879445/25143820/7777c2d8-2431-11e7-87be-4d1ac71aaa63.png)

**Comment by 9662** [comment]
> Seeing the same issue here. But the weirdest thing is that it wasn't happening until now. I last used the Android client on my home WiFi on Sunday and it worked fine.

To comment on this, what happened between that Sunday and when I posted the above was that my ISP had an IPv6 meltdown thanks to an internal equipment upgrade, so while the phone did get an IPv6 address and could talk IPv6 with my router, all IPv6 was being dropped at some point latter in my ISP's network.

**Comment by michaelstingl** [comment]
In version 2.9, the ownCloud Android app [switched to a new networking library](https://owncloud.org/news/android-app-release-2-9-1-usability-improvements-new-network-library/). I'd assume this issue is gone. In case this happens again, please open a new issue.  (too many things changed)
