### ISSUE TITLE
Android 4.2.2 client: Server instance not found

### ISSUE THREAD

**Issue by eribertomota** [owncloud/android#1316]
Hi,

When connecting from Android 4.2.2, I get "Server instance not found". So, I used tcpdump to see the connection in server side. The results are:

18:33:20.717832 IP 192.168.0.200.58648 > 192.168.0.100.80: Flags [P.], seq 1:108, ack 1, win 229, options [nop,nop,TS val 7995951 ecr 397463523], length 107: HTTP: GET /status.php HTTP/1.1
E.../.@.@..C.......d...PA.-.;iz.....)>.....
.z./....GET /status.php HTTP/1.1
User-Agent: Mozilla/5.0 (Android) ownCloud-android/1.8.0
Host: 192.168.0.100

18:33:20.717896 IP 192.168.0.100.80 > 192.168.0.200.58648: Flags [.], ack 108, win 227, options [nop,nop,TS val 397463528 ecr 7995951], length 0
E..4..@.@......d.....P..;iz.A..(.....L.....
.....z./
18:33:20.718500 IP 192.168.0.100.80 > 192.168.0.200.58648: Flags [P.], seq 1:449, ack 108, win 227, options [nop,nop,TS val 397463528 ecr 7995951], length 448: HTTP: HTTP/1.1 404 Not Found
E.....@.@......d.....P..;iz.A..(...........
.....z./HTTP/1.1 404 Not Found
Date: Sat, 28 Nov 2015 20:33:20 GMT
Server: Apache/2.4.10 (Debian)
Content-Length: 287
Content-Type: text/html; charset=iso-8859-1

<!DOCTYPE HTML PUBLIC "-//IETF//DTD HTML 2.0//EN">
<html><head>
<title>404 Not Found</title>
</head><body>
<h1>Not Found</h1>
<p>The requested URL /status.php was not found on this server.</p>
<hr>
<address>Apache/2.4.10 (Debian) Server at 192.168.0.100 Port 80</address>
</body></html>

On Debian, in /usr/share/owncloud, I can see the file status.php.

My server do not use SSL and I am connecting via IPv4.

Thanks,

Eriberto

**Comment by tobiasKaminsky** [comment]
Can you see the status.php with the android browser? http://192.168.0.100/owncloud/status.php?
(or wherever you have installed the owncloud instance)

**Comment by eribertomota** [comment]
Yes, I can see:

{"installed":"true","version":"7.0.4.2","versionstring":"7.0.4","edition":""}


Em domingo, 29 de novembro de 2015, Tobias Kaminsky <
notifications@github.com> escreveu:
> Can you see the status.php with the android browser?
http://192.168.0.100/owncloud/status.php?
> (or wherever you have installed the owncloud instance)
>
> —
> Reply to this email directly or view it on GitHub.<
https://ci6.googleusercontent.com/proxy/zonuuItwrWiup3-K0Y136zB-7m7xWzgUVbtwVjdYIzm7TnDrIPJ9bXXRalSqIZ3ghCda-PdePGye6kdR4qfPua3FQUMsSh-JikJrkTneEg8wXOUN7wpMZegCwON87yx4XMaFiy5gIJ6MLSHTpZtAjfZHZhIE6A=s0-d-e1-ft#https://github.com/notifications/beacon/AGIyrhREsv9ag39fuu-kVhxDq6DPoWIwks5pKsfUgaJpZM4Gq4mC.gif
>

**Comment by rekcah1986** [comment]
Me too.

**Comment by jesmrec** [comment]
@eribertomota still reproducible?
